{
  "version": 1,
  "generated_at": "2026-08-22T00:00:00Z",
  "scope": {
    "id": "example:payments-assurance",
    "kind": "specification",
    "label": "Example Payments API assurance surface"
  },
  "records": [
    {
      "assessment_id": "example:payments:authorization",
      "conclusion": "controlled",
      "severity": "high",
      "freshness": "current",
      "remediation": "resolved",
      "gate": "PASS",
      "authority": "authorized",
      "changed_since_baseline": true,
      "evidence_gaps": 0
    },
    {
      "assessment_id": "example:payments:replay",
      "conclusion": "assurance-gap",
      "severity": "high",
      "freshness": "retest-required",
      "remediation": "retest-pending",
      "gate": "INDETERMINATE",
      "authority": "not-evaluated",
      "changed_since_baseline": true,
      "evidence_gaps": 2
    },
    {
      "assessment_id": "example:payments:documentation",
      "conclusion": "not-applicable",
      "freshness": "current",
      "remediation": "none",
      "gate": "not-evaluated",
      "authority": "not-required",
      "changed_since_baseline": false,
      "evidence_gaps": 0
    }
  ],
  "summary": {
    "total": 3,
    "action_required": 1,
    "stale_or_retest": 1,
    "evidence_gaps": 2,
    "gate_blocked": 1,
    "authority_blocked": 0,
    "changed": 2
  },
  "notes": [
    "Counts are operational views over portable assurance records, not an assurance score.",
    "Gate and authority posture remain distinct: PASS does not confer authority."
  ]
}
